{
  "title": "Локация",
  "type": "object",
  "description": "Используется для создания мест обработки перевозки",


  "required": [
    "title",
    "address",
    "terminals"
  ],
  "properties": {
    "title": {
      "type": "string"
    },
    "address": {
      "type": "string"
    },
    "terminals": {
      "type": "array",
      "items": {
        "oneOf": [
          {
            "$ref": "../props/link.json"
          },
          {
            "$ref": "../abstract/rich-list-item.json"
          }
        ]
      }
    },
    "level": {
      "type": "string"
    }
  },
  "$schema": "https://json-schema.org/draft/2020-12/schema",
  "examples": [
    {
      "title": "Склад Москва-1",
      "address": "г. Москва, ул. Складская, д. 1",
      "terminals": [
        {
          "id": "1a2b3c4d-5e6f-7g8h-9i0j-1k2l3m4n5o6p",
          "title": "Терминал А"
        }
      ],
      "level": "Первый"
    },
    {
      "title": "Склад Санкт-Петербург-2",
      "address": "г. Санкт-Петербург, пр. Индустриальный, д. 10",
      "terminals": [
        {
          "id": "2b3c4d5e-6f7g-8h9i-0j1k-2l3m4n5o6p7q",
          "title": "Терминал Б"
        }
      ],
      "level": "Второй"
    },
    {
      "title": "Склад Екатеринбург-3",
      "address": "г. Екатеринбург, ул. Логистическая, д. 5",
      "terminals": [
        {
          "id": "3c4d5e6f-7g8h-9i0j-1k2l-3m4n5o6p7q8r",
          "title": "Терминал В"
        }
      ],
      "level": "Третий"
    },
    {
      "title": "Склад Казань-4",
      "address": "г. Казань, ул. Грузовая, д. 15",
      "terminals": [
        {
          "id": "4d5e6f7g-8h9i-0j1k-2l3m-4n5o6p7q8r9s",
          "title": "Терминал Г"
        }
      ],
      "level": "Первый"
    },
    {
      "title": "Склад Новосибирск-5",
      "address": "г. Новосибирск, ул. Транспортная, д. 20",
      "terminals": [
        {
          "id": "5e6f7g8h-9i0j-1k2l-3m4n-5o6p7q8r9s0t",
          "title": "Терминал Д"
        }
      ],
      "level": "Второй"
    },
    {
      "title": "Склад Ростов-на-Дону-6",
      "address": "г. Ростов-на-Дону, ул. Логистическая, д. 25",
      "terminals": [
        {
          "id": "6f7g8h9i-0j1k-2l3m-4n5o-6p7q8r9s0t1u",
          "title": "Терминал Е"
        }
      ],
      "level": "Третий"
    },
    {
      "title": "Склад Нижний Новгород-7",
      "address": "г. Нижний Новгород, ул. Складская, д. 30",
      "terminals": [
        {
          "id": "7g8h9i0j-1k2l-3m4n-5o6p-7q8r9s0t1u2v",
          "title": "Терминал Ж"
        }
      ],
      "level": "Первый"
    },
    {
      "title": "Склад Воронеж-8",
      "address": "г. Воронеж, ул. Грузовая, д. 35",
      "terminals": [
        {
          "id": "8h9i0j1k-2l3m-4n5o-6p7q-8r9s0t1u2v3w",
          "title": "Терминал З"
        }
      ],
      "level": "Второй"
    },
    {
      "title": "Склад Самара-9",
      "address": "г. Самара, ул. Транспортная, д. 40",
      "terminals": [
        {
          "id": "9i0j1k2l-3m4n-5o6p-7q8r-9s0t1u2v3w4" },
        {
          "id": "0j1k2l3m-4n5o-6p7q-8r9s0t1u2v3w4x5y",
          "title": "Терминал И"
        }
      ],
      "level": "Третий"
    }
  ]
}