[
  {
    "title": "1oFtPpAgtFOqTqedm",
    "address": "WKlTb0ZmG5VGVQS",
    "terminals": [
      {
        "error": "Unable to resolve reference: ../props/link.json"
      },
      {
        "error": "Unable to resolve reference: ../props/link.json"
      },
      {
        "error": "Unable to resolve reference: ../props/link.json"
      },
      {
        "error": "Unable to resolve reference: ../abstract/rich-list-item.json"
      },
      {
        "error": "Unable to resolve reference: ../abstract/rich-list-item.json"
      }
    ],
    "level": "qOnsl3X9mddWpqn"
  },
  {
    "title": "Khub6RHqzFyD",
    "address": "hl63w4",
    "terminals": [
      {
        "error": "Unable to resolve reference: ../abstract/rich-list-item.json"
      }
    ],
    "level": "GatxdxJH1MV6mWGeokOA"
  },
  {
    "title": "0lxrjC",
    "address": "S9KJ1D1K",
    "terminals": [
      {
        "error": "Unable to resolve reference: ../props/link.json"
      },
      {
        "error": "Unable to resolve reference: ../props/link.json"
      },
      {
        "error": "Unable to resolve reference: ../abstract/rich-list-item.json"
      }
    ],
    "level": "MiZmdeHaDJC"
  },
  {
    "title": "4ZY5ZeW",
    "address": "wpt1Kbbrv",
    "terminals": [
      {
        "error": "Unable to resolve reference: ../props/link.json"
      },
      {
        "error": "Unable to resolve reference: ../abstract/rich-list-item.json"
      },
      {
        "error": "Unable to resolve reference: ../props/link.json"
      }
    ],
    "level": "6590HGk3Po5o"
  },
  {
    "title": "vZvFMMhiQmbB9F5aP",
    "address": "QL3uBcYFN",
    "terminals": [
      {
        "error": "Unable to resolve reference: ../abstract/rich-list-item.json"
      },
      {
        "error": "Unable to resolve reference: ../abstract/rich-list-item.json"
      }
    ],
    "level": "tsrsEUglO4xy6E62RJ"
  },
  {
    "title": "uu5kG7M",
    "address": "eVzDEo",
    "terminals": [
      {
        "error": "Unable to resolve reference: ../props/link.json"
      },
      {
        "error": "Unable to resolve reference: ../abstract/rich-list-item.json"
      },
      {
        "error": "Unable to resolve reference: ../props/link.json"
      },
      {
        "error": "Unable to resolve reference: ../abstract/rich-list-item.json"
      }
    ],
    "level": "owlVuK408r"
  },
  {
    "title": "eFf9hU64dHaCGvo",
    "address": "rCUWXuagrt",
    "terminals": [
      {
        "error": "Unable to resolve reference: ../abstract/rich-list-item.json"
      },
      {
        "error": "Unable to resolve reference: ../abstract/rich-list-item.json"
      },
      {
        "error": "Unable to resolve reference: ../abstract/rich-list-item.json"
      },
      {
        "error": "Unable to resolve reference: ../abstract/rich-list-item.json"
      },
      {
        "error": "Unable to resolve reference: ../abstract/rich-list-item.json"
      }
    ],
    "level": "N7p6bWYa7u8C7Q"
  },
  {
    "title": "yVX7dt2Czd7TZ26T",
    "address": "XVQTouPGEeCG1iD",
    "terminals": [
      {
        "error": "Unable to resolve reference: ../props/link.json"
      }
    ],
    "level": "Lbd2eYGgvbD2"
  },
  {
    "title": "yLFpsA07fCbou6gR2",
    "address": "4n2DxGHEbF5IHfHd",
    "terminals": [
      {
        "error": "Unable to resolve reference: ../abstract/rich-list-item.json"
      },
      {
        "error": "Unable to resolve reference: ../props/link.json"
      },
      {
        "error": "Unable to resolve reference: ../abstract/rich-list-item.json"
      }
    ],
    "level": "HaH7HGL3poVWX6J8Km"
  },
  {
    "title": "7xSxq7XZdNNyHiT",
    "address": "iqouAM9vRQ",
    "terminals": [
      {
        "error": "Unable to resolve reference: ../abstract/rich-list-item.json"
      },
      {
        "error": "Unable to resolve reference: ../abstract/rich-list-item.json"
      },
      {
        "error": "Unable to resolve reference: ../props/link.json"
      }
    ],
    "level": "v6MV9J7Kx"
  }
]